{
  "$schema": "./schemas/inventory.schema.json",
  "schemaVersion": 1,
  "generatedFromTreeHash": "01f179b28c2de406e22388ec175234c6ae437bf437a8e8c34a8b3bfb51330521",
  "packages": [
    {
      "name": "@better-auth/api-key",
      "version": "1.6.26",
      "path": "packages/api-key",
      "private": false,
      "exports": [
        {
          "subpath": ".",
          "target": {
            "dev-source": "./src/index.ts",
            "types": "./dist/index.d.mts",
            "default": "./dist/index.mjs"
          }
        },
        {
          "subpath": "./client",
          "target": {
            "dev-source": "./src/client.ts",
            "types": "./dist/client.d.mts",
            "default": "./dist/client.mjs"
          }
        },
        {
          "subpath": "./types",
          "target": {
            "dev-source": "./src/types.ts",
            "types": "./dist/types.d.mts",
            "default": "./dist/types.mjs"
          }
        }
      ],
      "bins": []
    },
    {
      "name": "better-auth",
      "version": "1.6.26",
      "path": "packages/better-auth",
      "private": false,
      "exports": [
        {
          "subpath": ".",
          "target": {
            "dev-source": "./src/index.ts",
            "types": "./dist/index.d.mts",
            "default": "./dist/index.mjs"
          }
        },
        {
          "subpath": "./adapters",
          "target": {
            "dev-source": "./src/adapters/index.ts",
            "types": "./dist/adapters/index.d.mts",
            "default": "./dist/adapters/index.mjs"
          }
        },
        {
          "subpath": "./adapters/drizzle",
          "target": {
            "dev-source": "./src/adapters/drizzle-adapter/index.ts",
            "types": "./dist/adapters/drizzle-adapter/index.d.mts",
            "default": "./dist/adapters/drizzle-adapter/index.mjs"
          }
        },
        {
          "subpath": "./adapters/memory",
          "target": {
            "dev-source": "./src/adapters/memory-adapter/index.ts",
            "types": "./dist/adapters/memory-adapter/index.d.mts",
            "default": "./dist/adapters/memory-adapter/index.mjs"
          }
        },
        {
          "subpath": "./adapters/mongodb",
          "target": {
            "dev-source": "./src/adapters/mongodb-adapter/index.ts",
            "types": "./dist/adapters/mongodb-adapter/index.d.mts",
            "default": "./dist/adapters/mongodb-adapter/index.mjs"
          }
        },
        {
          "subpath": "./adapters/prisma",
          "target": {
            "dev-source": "./src/adapters/prisma-adapter/index.ts",
            "types": "./dist/adapters/prisma-adapter/index.d.mts",
            "default": "./dist/adapters/prisma-adapter/index.mjs"
          }
        },
        {
          "subpath": "./api",
          "target": {
            "dev-source": "./src/api/index.ts",
            "types": "./dist/api/index.d.mts",
            "default": "./dist/api/index.mjs"
          }
        },
        {
          "subpath": "./client",
          "target": {
            "dev-source": "./src/client/index.ts",
            "types": "./dist/client/index.d.mts",
            "default": "./dist/client/index.mjs"
          }
        },
        {
          "subpath": "./client/plugins",
          "target": {
            "dev-source": "./src/client/plugins/index.ts",
            "types": "./dist/client/plugins/index.d.mts",
            "default": "./dist/client/plugins/index.mjs"
          }
        },
        {
          "subpath": "./cookies",
          "target": {
            "dev-source": "./src/cookies/index.ts",
            "types": "./dist/cookies/index.d.mts",
            "default": "./dist/cookies/index.mjs"
          }
        },
        {
          "subpath": "./crypto",
          "target": {
            "dev-source": "./src/crypto/index.ts",
            "types": "./dist/crypto/index.d.mts",
            "default": "./dist/crypto/index.mjs"
          }
        },
        {
          "subpath": "./db",
          "target": {
            "dev-source": "./src/db/index.ts",
            "types": "./dist/db/index.d.mts",
            "default": "./dist/db/index.mjs"
          }
        },
        {
          "subpath": "./db/adapter",
          "target": {
            "dev-source": "./src/db/adapter-kysely.ts",
            "types": "./dist/db/adapter-kysely.d.mts",
            "default": "./dist/db/adapter-kysely.mjs"
          }
        },
        {
          "subpath": "./db/adapter/minimal",
          "target": {
            "dev-source": "./src/db/adapter-base.ts",
            "types": "./dist/db/adapter-base.d.mts",
            "default": "./dist/db/adapter-base.mjs"
          }
        },
        {
          "subpath": "./db/migration",
          "target": {
            "dev-source": "./src/db/get-migration.ts",
            "types": "./dist/db/get-migration.d.mts",
            "default": "./dist/db/get-migration.mjs"
          }
        },
        {
          "subpath": "./lynx",
          "target": {
            "dev-source": "./src/client/lynx/index.ts",
            "types": "./dist/client/lynx/index.d.mts",
            "default": "./dist/client/lynx/index.mjs"
          }
        },
        {
          "subpath": "./minimal",
          "target": {
            "dev-source": "./src/auth/minimal.ts",
            "types": "./dist/auth/minimal.d.mts",
            "default": "./dist/auth/minimal.mjs"
          }
        },
        {
          "subpath": "./next-js",
          "target": {
            "dev-source": "./src/integrations/next-js.ts",
            "types": "./dist/integrations/next-js.d.mts",
            "default": "./dist/integrations/next-js.mjs"
          }
        },
        {
          "subpath": "./node",
          "target": {
            "dev-source": "./src/integrations/node.ts",
            "types": "./dist/integrations/node.d.mts",
            "default": "./dist/integrations/node.mjs"
          }
        },
        {
          "subpath": "./oauth2",
          "target": {
            "dev-source": "./src/oauth2/index.ts",
            "types": "./dist/oauth2/index.d.mts",
            "default": "./dist/oauth2/index.mjs"
          }
        },
        {
          "subpath": "./plugins",
          "target": {
            "dev-source": "./src/plugins/index.ts",
            "types": "./dist/plugins/index.d.mts",
            "default": "./dist/plugins/index.mjs"
          }
        },
        {
          "subpath": "./plugins/access",
          "target": {
            "dev-source": "./src/plugins/access/index.ts",
            "types": "./dist/plugins/access/index.d.mts",
            "default": "./dist/plugins/access/index.mjs"
          }
        },
        {
          "subpath": "./plugins/admin",
          "target": {
            "dev-source": "./src/plugins/admin/index.ts",
            "types": "./dist/plugins/admin/index.d.mts",
            "default": "./dist/plugins/admin/index.mjs"
          }
        },
        {
          "subpath": "./plugins/admin/access",
          "target": {
            "dev-source": "./src/plugins/admin/access/index.ts",
            "types": "./dist/plugins/admin/access/index.d.mts",
            "default": "./dist/plugins/admin/access/index.mjs"
          }
        },
        {
          "subpath": "./plugins/anonymous",
          "target": {
            "dev-source": "./src/plugins/anonymous/index.ts",
            "types": "./dist/plugins/anonymous/index.d.mts",
            "default": "./dist/plugins/anonymous/index.mjs"
          }
        },
        {
          "subpath": "./plugins/bearer",
          "target": {
            "dev-source": "./src/plugins/bearer/index.ts",
            "types": "./dist/plugins/bearer/index.d.mts",
            "default": "./dist/plugins/bearer/index.mjs"
          }
        },
        {
          "subpath": "./plugins/custom-session",
          "target": {
            "dev-source": "./src/plugins/custom-session/index.ts",
            "types": "./dist/plugins/custom-session/index.d.mts",
            "default": "./dist/plugins/custom-session/index.mjs"
          }
        },
        {
          "subpath": "./plugins/device-authorization",
          "target": {
            "dev-source": "./src/plugins/device-authorization/index.ts",
            "types": "./dist/plugins/device-authorization/index.d.mts",
            "default": "./dist/plugins/device-authorization/index.mjs"
          }
        },
        {
          "subpath": "./plugins/email-otp",
          "target": {
            "dev-source": "./src/plugins/email-otp/index.ts",
            "types": "./dist/plugins/email-otp/index.d.mts",
            "default": "./dist/plugins/email-otp/index.mjs"
          }
        },
        {
          "subpath": "./plugins/generic-oauth",
          "target": {
            "dev-source": "./src/plugins/generic-oauth/index.ts",
            "types": "./dist/plugins/generic-oauth/index.d.mts",
            "default": "./dist/plugins/generic-oauth/index.mjs"
          }
        },
        {
          "subpath": "./plugins/haveibeenpwned",
          "target": {
            "dev-source": "./src/plugins/haveibeenpwned/index.ts",
            "types": "./dist/plugins/haveibeenpwned/index.d.mts",
            "default": "./dist/plugins/haveibeenpwned/index.mjs"
          }
        },
        {
          "subpath": "./plugins/jwt",
          "target": {
            "dev-source": "./src/plugins/jwt/index.ts",
            "types": "./dist/plugins/jwt/index.d.mts",
            "default": "./dist/plugins/jwt/index.mjs"
          }
        },
        {
          "subpath": "./plugins/magic-link",
          "target": {
            "dev-source": "./src/plugins/magic-link/index.ts",
            "types": "./dist/plugins/magic-link/index.d.mts",
            "default": "./dist/plugins/magic-link/index.mjs"
          }
        },
        {
          "subpath": "./plugins/mcp/client",